{
  "concepts": [
    {
      "id": "shaul:concept:son-of-man",
      "kind": "concept",
      "names": {
        "es": "Hijo del Hombre"
      },
      "owner": "shaul",
      "provenance": {
        "locator": {
          "kind": "yaml",
          "pointer": ""
        },
        "origin": "authored",
        "publication": "draft",
        "review": "unreviewed",
        "source_id": "source:shaul-son-of-man",
        "transformation": "normalized",
        "visibility": "public"
      },
      "source_record": {
        "aliases": [
          "Hijo del Hombre",
          "Ben Ha'Adam",
          "Ben HaAdam",
          "Bar Enash"
        ],
        "articles": [
          {
            "path": "besorah/marcos_ben_adam_metamorfosis_glosario",
            "title": "Marcos: Ben Adam, metamorfosis y glosario mesiánico"
          },
          {
            "path": "besorah/marcos_hijo_elohim_hijo_hombre_herencia",
            "title": "Marcos: Hijo de Elohim, Hijo del Hombre y herencia"
          },
          {
            "path": "besorah/marcos_14_pesaj_pacto_getsemani_juicio",
            "title": "Marcos 14: Pésaj, pacto renovado, Getsemaní y el juicio"
          },
          {
            "path": "temas/ben_hijo_titulos_mesias",
            "title": "Ben, Adam y el Hijo dado al Mesías"
          }
        ],
        "description": "Un concepto experimental que reúne formas lingüísticas y menciones intertextuales sin borrar su especificidad léxica.",
        "forms": [
          {
            "role": "aramaic_expression",
            "word": "word:bar-enash-ar"
          },
          {
            "role": "hebrew_expression",
            "word": "word:ben-ha-adam-he"
          }
        ],
        "id": "son-of-man",
        "names": {
          "es": "Hijo del Hombre"
        },
        "related_concepts": [
          "concept:son"
        ],
        "summary": {
          "what_it_is": "Hijo del Hombre reúne el בן האדם — Ben HaAdam de Marcos con el בר אנש — Bar Enash de Daniel 7. Daniel ve a uno como hijo de hombre después de las bestias y le son dados dominio, honra y reino; Marcos une el Ben HaAdam con padecimiento, muerte, resurrección y venida en nubes. El concepto también se lee dentro de la pregunta adámica: el Mesías es el Hombre de arriba, en quien la vocación y el dominio destinados al hombre llegan a su cumplimiento.",
          "what_it_is_not": "No es simplemente una manera de decir que Yeshua era humano, ni una etiqueta que pueda separarse de Daniel 7, del reino, del padecimiento y de la resurrección. Tampoco es correcto convertir בן — ben en «heredero» o «repartidor» como si esa fuera su traducción fija en todas sus apariciones; las notas presentan esa relación como una lectura contextual y pedagógica."
        },
        "type": "concept"
      },
      "upstream_id": "concept:son-of-man"
    },
    {
      "id": "shaul:expression:bar-enash-ar",
      "kind": "expression",
      "names": {
        "und": "בר אנש"
      },
      "owner": "shaul",
      "provenance": {
        "locator": {
          "kind": "yaml",
          "pointer": ""
        },
        "origin": "authored",
        "publication": "draft",
        "review": "unreviewed",
        "source_id": "source:shaul-bar-enash-ar",
        "transformation": "normalized",
        "visibility": "public"
      },
      "source_record": {
        "aliases": [
          "bar enash"
        ],
        "id": "bar-enash-ar",
        "language": "aramaic",
        "script": "בר אנש",
        "transliteration": "Bar Enash",
        "type": "word"
      },
      "upstream_id": "word:bar-enash-ar"
    },
    {
      "id": "shaul:expression:ben-ha-adam-he",
      "kind": "expression",
      "names": {
        "und": "בן האדם"
      },
      "owner": "shaul",
      "provenance": {
        "locator": {
          "kind": "yaml",
          "pointer": ""
        },
        "origin": "authored",
        "publication": "draft",
        "review": "unreviewed",
        "source_id": "source:shaul-ben-ha-adam-he",
        "transformation": "normalized",
        "visibility": "public"
      },
      "source_record": {
        "aliases": [
          "Ben HaAdam",
          "Ben Adam"
        ],
        "id": "ben-ha-adam-he",
        "language": "hebrew",
        "script": "בן האדם",
        "transliteration": "Ben Ha'Adam",
        "type": "word"
      },
      "upstream_id": "word:ben-ha-adam-he"
    }
  ],
  "editions": [
    {
      "attribution": "Existing Davar Delitzsch parsed dataset; retain original source notices.",
      "id": "delitzsch",
      "language": "he",
      "name": "Delitzsch parsed Hebrew",
      "owner": "davar",
      "reference_system_id": "davar-v1",
      "source_kind": "biblical_text",
      "source_revision": "ff2e1ad93eb2cea7407d5e93e14b5a532d16f602"
    },
    {
      "attribution": "Existing Davar OE dataset; retain its original source notices. Aramaic morphology is preserved.",
      "id": "oe",
      "language": "mul",
      "name": "OE Hebrew/Aramaic source",
      "owner": "davar",
      "reference_system_id": "davar-v1",
      "source_kind": "biblical_text",
      "source_revision": "ff2e1ad93eb2cea7407d5e93e14b5a532d16f602"
    },
    {
      "attribution": "SBLGNT / STEPBible TAGNT. Derived from Davar's committed preview. See docs/greek-besorah-source-licenses.md and data/greek/preview; existing notices and release restrictions continue to apply.",
      "id": "sblgnt-tagnt",
      "language": "grc",
      "name": "SBLGNT with TAGNT annotation",
      "owner": "davar",
      "reference_system_id": "tagnt-native",
      "source_kind": "biblical_text",
      "source_revision": "ae39711d7843b2902d54993e432de9c12d6a4b9a"
    },
    {
      "attribution": "Original TTH text and footnotes from data/tth_2/json; existing attribution and permissions apply.",
      "id": "tth-es",
      "language": "es",
      "name": "TTH Spanish",
      "owner": "davar",
      "reference_system_id": "translation-legacy",
      "source_kind": "translation",
      "source_revision": "ff2e1ad93eb2cea7407d5e93e14b5a532d16f602"
    }
  ],
  "evidence": [
    {
      "content": {
        "lemma": "בַּר",
        "source_entry_id": "H1247"
      },
      "id": "evidence:bdb:H1247",
      "kind": "lexical_entry",
      "provenance": {
        "locator": {
          "kind": "json",
          "pointer": "/H1247"
        },
        "origin": "source",
        "publication": "draft",
        "review": "unreviewed",
        "source_id": "source:bdb",
        "transformation": "normalized",
        "visibility": "public"
      },
      "targets": [
        {
          "kind": "external_lexical",
          "reference": {
            "code": "H1247",
            "namespace": "strong"
          }
        }
      ]
    },
    {
      "content": {
        "lemma": "דָּבָר",
        "source_entry_id": "H1697"
      },
      "id": "evidence:bdb:H1697",
      "kind": "lexical_entry",
      "provenance": {
        "locator": {
          "kind": "json",
          "pointer": "/H1697"
        },
        "origin": "source",
        "publication": "draft",
        "review": "unreviewed",
        "source_id": "source:bdb",
        "transformation": "normalized",
        "visibility": "public"
      },
      "targets": [
        {
          "kind": "external_lexical",
          "reference": {
            "code": "H1697",
            "namespace": "strong"
          }
        }
      ]
    },
    {
      "content": {
        "lemma": "אֱלֹהִים",
        "source_entry_id": "H430"
      },
      "id": "evidence:bdb:H430",
      "kind": "lexical_entry",
      "provenance": {
        "locator": {
          "kind": "json",
          "pointer": "/H430"
        },
        "origin": "source",
        "publication": "draft",
        "review": "unreviewed",
        "source_id": "source:bdb",
        "transformation": "normalized",
        "visibility": "public"
      },
      "targets": [
        {
          "kind": "external_lexical",
          "reference": {
            "code": "H430",
            "namespace": "strong"
          }
        }
      ]
    },
    {
      "content": {
        "lemma": "אֱנָשׁ",
        "source_entry_id": "H606"
      },
      "id": "evidence:bdb:H606",
      "kind": "lexical_entry",
      "provenance": {
        "locator": {
          "kind": "json",
          "pointer": "/H606"
        },
        "origin": "source",
        "publication": "draft",
        "review": "unreviewed",
        "source_id": "source:bdb",
        "transformation": "normalized",
        "visibility": "public"
      },
      "targets": [
        {
          "kind": "external_lexical",
          "reference": {
            "code": "H606",
            "namespace": "strong"
          }
        }
      ]
    },
    {
      "content": {
        "explanation": "Hijo del Hombre; un título para el Mesías.",
        "marker": "²³",
        "number": "23",
        "word": "Ben Ha'Adam"
      },
      "id": "evidence:passage:tth-es:john:1:375cb7332358a19359cbe69dbb94a68680e888cb0bbf60f1fda964a3c4318f55:footnote:0",
      "kind": "footnote",
      "provenance": {
        "locator": {
          "kind": "json",
          "pointer": "/chapters/0/verses/50/footnotes/0"
        },
        "origin": "source",
        "publication": "draft",
        "review": "unreviewed",
        "source_id": "source:tth",
        "transformation": "normalized",
        "visibility": "public"
      },
      "targets": [
        {
          "id": "passage:tth-es:john:1:375cb7332358a19359cbe69dbb94a68680e888cb0bbf60f1fda964a3c4318f55",
          "kind": "passage"
        }
      ]
    },
    {
      "content": {
        "explanation": "O, lo mejor. Heb.: Reshit.",
        "marker": "¹",
        "number": "1",
        "word": "primicia"
      },
      "id": "evidence:passage:tth-es:john:1:8b7e01bd10442fcd11e0ef04c9887fe9a7bdd611dd6dc80f5d04973aa9e988d2:footnote:0",
      "kind": "footnote",
      "provenance": {